{
    "id": "patient",
    "gender": "female",
    "motherId": "mom",
    "fatherId": "dad",
    "family": [{
            "id": "mom",
            "gender": "female",
            "motherId": null,
            "fatherId": null,
            "relationship": "mother"
        },
        {
            "id": "dad",
            "gender": "male",
            "motherId": "grandma",
            "fatherId": "grandpa",
            "relationship": "father"
        },
        {
            "id": "grandpa",
            "gender": "male",
            "motherId": null,
            "fatherId": null,
            "relationship": "paternal grandfather",
            "cancers": [{
                "cancerType": "gastric"
            }]
        },
        {
            "id": "grandma",
            "gender": "female",
            "motherId": null,
            "fatherId": null,
            "relationship": "paternal grandmother",
            "cancers": [{
                "cancerType": "kidney"
            }]
        }
    ]
}
