{
    "id": "abc123",
    "motherId": "mama",
    "fatherId": "papa",
    "firstName": "John",
    "lastName": "CancerIQ",
    "gender": "male",
    "dateOfBirth": "1950-03-25",
    "cancers": [{
        "cancerType": "brain"
    }],
    "family": [{
            "id": "papa",
            "motherId": "granny",
            "fatherId": null,
            "relationship": "father",
            "gender": "male"
        },
        {
            "id": "mama",
            "age": 77,
            "motherId": null,
            "fatherId": null,
            "relationship": "mother",
            "gender": "female",
            "cancers": [{
                "cancerType": "breast",
                "ageOfDiagnosis": 50
            }]
        },
        {
            "id": "granny",
            "motherId": null,
            "fatherId": null,
            "relationship": "paternal grandmother",
            "gender": "female"
        }
    ]
}
